,Turn,Civ1,Civ2,Relation,Value,Cable
0,19,Germany,Inca,Embassy,Embassy establish,We desired a deal to authorize a foreign service post in The Incass top city and thus suggested an accord to authorize an embassy in Germanys seat of government in exchange
0,71,Inca,Iroquois,Embassy,Embassy establish,We wished for a deal to consent to a foreign service post in The Iroquoiss seat of government and thus proposed an accord to consent to a diplomatic outpost in The Incass seat of government in payment
0,158,Korea,Iroquois,Embassy,Embassy establish,We yearned for a deal to consent to an embassy in The Iroquoiss top city and thus offered a deal to allow a foreign service post in Koreas capital city in recompense
0,214,Songhai,Iroquois,Embassy,Embassy establish,We hoped for an accord to allow an embassy in The Iroquoiss capital city and thus offered an agreement to authorize a foreign service post in Songhais seat of government in return
0,346,Germany,Songhai,Embassy,Embassy establish,We hoped for an accord to allow an embassy in Songhais top city and thus volunteered an accord to consent to a diplomatic outpost in Germanys capital in recompense
0,368,Morocco,Songhai,Embassy,Embassy establish,We needed an accord to permit an embassy in Songhais administrative center and thus suggested 2 units of gold per turn for the next 30 turns in return
0,402,Morocco,Songhai,Embassy,Embassy establish,We were giddy to swap with Songhai specifically for an accord to permit an embassy in Songhais top city
0,451,Germany,Songhai,Embassy,Embassy establish,We were enthusiastic to trade with Songhai overwhelmingly for an agreement to authorize an embassy in Songhais administrative center
